<?xml version="1.0"?>
<!--
To change this license header, choose License Headers in Project Properties.
To change this template file, choose Tools | Templates
and open the template in the editor.
-->

<xs:schema version="1.0"
           xmlns:xs="http://www.w3.org/2001/XMLSchema"
           elementFormDefault="qualified">
   
    <xs:complexType name="cthistoria">
        <xs:simpleContent>
            <xs:extension base="xs:string">
                <xs:attribute name="filas" type="xs:integer" />
            </xs:extension>
        </xs:simpleContent>
    </xs:complexType>
    
    <xs:complexType name="ctpatentado">
        <xs:attribute name="valor" type="xs:string" default="si" />
    </xs:complexType>
    
    <xs:complexType name="ctarchivado" mixed="true">
        <xs:sequence>
            <xs:element name="bibliotecario" type="xs:string" />
            <xs:element name="fecha" type="xs:date" />
        </xs:sequence>
        <xs:attribute name="doc" type="xs:string" />
    </xs:complexType>
    
    <xs:complexType name="ctinventor">
        <xs:sequence>
            <xs:element name="pais" type="xs:string" />
            <xs:element name="fechanacimi" type="xs:date" />
            <xs:element name="historia" type="cthistoria" />
            <xs:element name="archivado" type="ctarchivado" />
            <xs:element name="patentado" type="ctpatentado" />
        </xs:sequence>
        <xs:attribute name="nombre" type="xs:string" use="required"/>
        <xs:attribute name="invento" type="xs:string" />
    </xs:complexType>
    
    <xs:complexType name="ctinventores">
        <xs:sequence>
            <xs:element name="inventor" maxOccurs="unbounded" type="ctinventor" />
        </xs:sequence>
    </xs:complexType>
    
    <xs:element name="inventores" type="ctinventores"/>
</xs:schema>
